{
  "title": "Bitcoin Breaks $50K on Record ETF Inflows | Crypto Daily Briefing Jan 15 2025",
  "description": "Bitcoin crossed the $50,000 mark today during Asian trading hours, fuelled by the largest single-day spot ETF inflow on record — over $500 million in one session. Ethereum ETFs also recorded their second-best inflow day since approval, signalling broad institutional demand across the crypto market.\n\nIn today's briefing:\n- Spot Bitcoin ETF inflows hit all-time daily record above $500M\n- Bitcoin briefly touches $50,000 — key psychological level tested\n- Ethereum ETFs see second-best inflow day since launch\n- On-chain data shows long-term holders accumulating\n- Tomorrow's watchpoints: $50K close confirmation and FOMC calendar\n\nStay ahead of the market — subscribe for the daily crypto briefing and hit the bell so you never miss an update.",
  "tags": [
    "bitcoin",
    "crypto",
    "bitcoin etf",
    "spot bitcoin etf",
    "btc price",
    "bitcoin all time high",
    "institutional crypto",
    "crypto news",
    "daily crypto briefing",
    "ethereum etf",
    "crypto market 2025",
    "btc $50k"
  ],
  "category": "News & Politics",
  "visibility": "public"
}
