{
  "title": "Fed Minutes: No Q1 Rate Cuts — S&P 500 Falls 1.2% | Finance Daily Briefing Jan 15 2025",
  "description": "Federal Reserve December FOMC minutes released today confirmed officials see no urgency to cut interest rates in early 2025. The S&P 500 fell 1.2% in response, the US dollar index climbed to a two-month high, and bond yields rose across the curve as markets repriced rate expectations sharply.\n\nIn today's briefing:\n- FOMC minutes rule out a Q1 rate cut — Fed stays higher for longer\n- S&P 500 drops 1.2% with rate-sensitive sectors leading losses\n- US dollar index hits two-month high; EUR/USD dips below 1.09\n- Treasury yields rise across the curve on hawkish Fed signal\n- Tomorrow's watchpoints: Fed speaker commentary and any policy tone shifts\n\nStay informed — subscribe for the daily finance briefing and never miss a market-moving macro event.",
  "tags": [
    "federal reserve",
    "fomc minutes",
    "interest rates",
    "finance news",
    "sp500",
    "stock market",
    "us dollar",
    "bond yields",
    "daily finance briefing",
    "rate cuts 2025",
    "macro markets",
    "fed policy"
  ],
  "category": "News & Politics",
  "visibility": "public"
}
